{
  "schema": "blackbook.index.update-batch.v1",
  "from": "2026-08-26T00:00:00.000000Z",
  "asOf": "2026-08-30T00:00:00.000000Z",
  "provider": "fotmob",
  "expectedMatchIds": [
    "fotmob:5749650",
    "fotmob:5749653",
    "fotmob:5749654",
    "fotmob:5749657",
    "fotmob:5749659",
    "fotmob:5795425",
    "fotmob:5795428",
    "fotmob:5795429",
    "fotmob:5795431",
    "fotmob:5795434",
    "fotmob:5802910",
    "fotmob:5802911",
    "fotmob:5802912",
    "fotmob:5802913",
    "fotmob:5802917",
    "fotmob:5802918",
    "fotmob:5868013",
    "fotmob:5868016",
    "fotmob:5868018",
    "fotmob:5868031",
    "fotmob:5868035",
    "fotmob:5868037",
    "fotmob:5868039",
    "fotmob:5868040",
    "fotmob:5881143",
    "fotmob:5881145",
    "fotmob:5881146",
    "fotmob:5881147",
    "fotmob:5881149",
    "fotmob:5881150",
    "fotmob:5881151",
    "fotmob:5987805",
    "fotmob:5987807",
    "fotmob:5987808",
    "fotmob:5987810",
    "fotmob:5987967",
    "fotmob:5987968",
    "fotmob:5987969",
    "fotmob:5987970",
    "fotmob:5987971",
    "fotmob:5987972",
    "fotmob:5987973",
    "fotmob:5987974",
    "fotmob:5987975",
    "fotmob:5987976",
    "fotmob:5987977",
    "fotmob:5987978",
    "fotmob:5988075",
    "fotmob:5988076",
    "fotmob:5988077",
    "fotmob:5988078",
    "fotmob:5988079",
    "fotmob:5988080",
    "fotmob:5988081",
    "fotmob:5988082",
    "fotmob:5988083",
    "fotmob:5988084",
    "fotmob:5988085",
    "fotmob:5988086",
    "fotmob:5988087",
    "fotmob:5988088",
    "fotmob:5988089",
    "fotmob:5988090",
    "fotmob:5988091",
    "fotmob:5988092",
    "fotmob:5988093",
    "fotmob:5988094",
    "fotmob:5988095",
    "fotmob:5988096",
    "fotmob:5988097",
    "fotmob:5988098"
  ]
}
