{
  "schema": "blackbook.index.update-batch.v1",
  "provider": "fotmob",
  "from": "2026-10-22T00:00:00.000000Z",
  "asOf": "2026-10-26T00:00:00.000000Z",
  "expectedMatchIds": [
    "fotmob:5881205",
    "fotmob:5749718",
    "fotmob:5802966",
    "fotmob:5795491",
    "fotmob:5868101",
    "fotmob:5795486",
    "fotmob:5868107",
    "fotmob:5749711",
    "fotmob:5749712",
    "fotmob:5881197",
    "fotmob:5881199",
    "fotmob:5881202",
    "fotmob:5881203",
    "fotmob:5881204",
    "fotmob:5795485",
    "fotmob:5795488",
    "fotmob:5868106",
    "fotmob:5749717",
    "fotmob:5795487",
    "fotmob:5868110",
    "fotmob:5881198",
    "fotmob:5749715",
    "fotmob:5802967",
    "fotmob:5868103",
    "fotmob:5749714",
    "fotmob:5868102",
    "fotmob:5749710",
    "fotmob:5749713",
    "fotmob:5795489",
    "fotmob:5795490",
    "fotmob:5795492",
    "fotmob:5795493",
    "fotmob:5802969",
    "fotmob:5881201",
    "fotmob:5868104",
    "fotmob:5802964",
    "fotmob:5802965",
    "fotmob:5802968",
    "fotmob:5802970",
    "fotmob:5802971",
    "fotmob:5795494",
    "fotmob:5881200",
    "fotmob:5749716",
    "fotmob:5868108",
    "fotmob:5749719",
    "fotmob:5868105"
  ]
}
